{
  "name": "linktree",
  "label": "Linktree",
  "features": {
    "terminal": false,
    "sidebar": false,
    "game": false,
    "particles": true,
    "statusBar": false,
    "quickCommands": false,
    "ownerLinks": false,
    "windowBar": false
  },
  "layout": {
    "mode": "linktree",
    "sidebarWidth": "0px",
    "terminalHeight": "0px",
    "borderRadius": "0px",
    "maxWidth": "720px",
    "maxHeight": "auto",
    "density": "normal"
  },
  "content": {
    "render": "links",
    "showLabels": false,
    "showOrder": false
  },
  "typography": {
    "baseSize": "16px",
    "lineHeight": "1.6",
    "letterSpacing": "0"
  },
  "css": "/* linktree: home shows section buttons, sections show their links, back button returns home */\n/* let the whole page scroll, not just the preview panel */\n[data-layout=\"linktree\"] body {\n    overflow-y: auto;\n    align-items: flex-start;\n}\n[data-layout=\"linktree\"] main {\n    width: min(720px, 92vw);\n    height: auto;\n    min-height: 92vh;\n}\n[data-layout=\"linktree\"] .terminal {\n    border: none;\n    background: transparent;\n    box-shadow: none;\n    height: auto;\n}\n[data-layout=\"linktree\"] .window-bar,\n[data-layout=\"linktree\"] .sidebar,\n[data-layout=\"linktree\"] .terminal-panel,\n[data-layout=\"linktree\"] .status-bar { display: none !important; }\n[data-layout=\"linktree\"] .body-split { flex-direction: column; }\n[data-layout=\"linktree\"] .preview-panel { background: transparent; }\n[data-layout=\"linktree\"] .preview-content {\n    padding: 56px 48px;\n    text-align: center;\n    display: flex;\n    flex-direction: column;\n    align-items: center;\n    overflow: visible;\n    height: auto;\n}\n[data-layout=\"linktree\"] .preview-content .section-label { display: none; }\n[data-layout=\"linktree\"] .preview-content h1 { font-size: 2.6rem; margin-bottom: 8px; }\n[data-layout=\"linktree\"] .preview-content p:first-of-type { color: var(--muted); font-size: 1.05rem; margin-bottom: 36px; }\n\n/* section buttons on home */\n.section-btn {\n    display: flex;\n    align-items: center;\n    justify-content: space-between;\n    width: 100%;\n    max-width: 600px;\n    padding: 18px 28px;\n    margin-bottom: 14px;\n    background: var(--window);\n    border: 1px solid var(--border);\n    border-radius: 14px;\n    color: var(--text);\n    text-decoration: none;\n    font-size: 1.05rem;\n    transition: .2s;\n    cursor: pointer;\n}\n.section-btn:hover {\n    border-color: var(--accent);\n    background: var(--hover);\n    transform: translateY(-2px);\n}\n.section-btn .arrow { color: var(--accent); transition: .2s; }\n.section-btn:hover .arrow { transform: translateX(4px); }\n\n/* back button */\n.back-btn {\n    all: unset;\n    cursor: pointer;\n    display: inline-flex;\n    align-items: center;\n    gap: 6px;\n    margin-bottom: 28px;\n    padding: 8px 16px;\n    color: var(--muted);\n    font-size: .9rem;\n    transition: .2s;\n}\n.back-btn:hover { color: var(--accent); }\n.back-btn .arrow { transition: .2s; }\n.back-btn:hover .arrow { transform: translateX(-3px); }\n\n/* link buttons (from renderLinks) */\n.link-btn {\n    display: flex;\n    align-items: center;\n    justify-content: space-between;\n    width: 100%;\n    max-width: 600px;\n    padding: 18px 28px;\n    margin-bottom: 14px;\n    background: var(--window);\n    border: 1px solid var(--border);\n    border-radius: 14px;\n    color: var(--text);\n    text-decoration: none;\n    font-size: 1.05rem;\n    transition: .2s;\n}\n.link-btn:hover {\n    border-color: var(--accent);\n    background: var(--hover);\n    transform: translateY(-2px);\n}\n.link-btn .arrow { color: var(--accent); transition: .2s; }\n.link-btn:hover .arrow { transform: translateX(4px); }\n\n.link-group { width: 100%; max-width: 600px; margin-bottom: 28px; }\n.link-group-title {\n    color: var(--muted-alt);\n    font-size: .8rem;\n    letter-spacing: .15em;\n    text-transform: uppercase;\n    margin-bottom: 12px;\n    text-align: left;\n}\n.link-group-desc { color: var(--muted); font-size: .9rem; margin-bottom: 12px; text-align: left; }"
}
